{"artifacts":{"output.json":"01e7c39f63f8704b0b25a1cac316a8e9ad2e6d4f77bf91beeec3d5494506a392"},"configuration_id":"68a5123a9db48ade8102fe887beb72b440edea7b60ec8e0404b2db122f19b89e","events":[{"content_ref":null,"id":"c214f70702f3a55a20eeac06:0","kind":"state","metadata":{"status":"running"},"sequence":0},{"content_ref":null,"id":"c214f70702f3a55a20eeac06:1","kind":"model_request","metadata":{},"sequence":1},{"content_ref":null,"id":"c214f70702f3a55a20eeac06:2","kind":"model_response","metadata":{},"sequence":2},{"content_ref":null,"id":"c214f70702f3a55a20eeac06:3","kind":"failure","metadata":{"category":"RuntimeFailure"},"sequence":3},{"content_ref":null,"id":"c214f70702f3a55a20eeac06:4","kind":"failure","metadata":{"category":"RuntimeFailure"},"sequence":4},{"content_ref":null,"id":"c214f70702f3a55a20eeac06:5","kind":"evaluator","metadata":{"evaluator":"exact-v1","score":null,"status":"error"},"sequence":5},{"content_ref":null,"id":"c214f70702f3a55a20eeac06:6","kind":"measurements","metadata":{"sources":{"cpu_seconds":"measured:process_time/harness-only","inference_seconds":"reported:backend/prompt+generation","peak_ram_bytes":"sampled:/proc/VmRSS/harness+ollama-process-tree/200ms","peak_vram_bytes":"sampled:nvidia-smi/ollama-process-tree-allocations/200ms","setup_seconds":"reported:backend/model-load","tool_seconds":"measured:perf_counter/tool-boundaries","wall_seconds":"measured:perf_counter/end-to-end"},"values":{"cpu_seconds":0.08325420499999936,"cpu_utilization":null,"energy_joules":null,"gpu_seconds":null,"gpu_utilization":null,"inference_seconds":0.166186,"peak_ram_bytes":815112192,"peak_vram_bytes":652214272,"setup_seconds":0.140714549,"tool_seconds":0,"wall_seconds":0.4079419070003496}},"sequence":6},{"content_ref":null,"id":"c214f70702f3a55a20eeac06:7","kind":"artifact","metadata":{"path":"output.json","sha256":"01e7c39f63f8704b0b25a1cac316a8e9ad2e6d4f77bf91beeec3d5494506a392"},"sequence":7}],"parent_run_id":null,"replayable":false,"run_id":"c214f70702f3a55a20eeac06","schema_version":1,"task_id":"sum"}
