{"artifacts":{"output.json":"e4accc79aab8cfb76f2409bdc9e22d5efa1bf7105a53c47ad8bd55d6e5f0648d"},"configuration_id":"f1830ddd9eb0f52de951cf392e6785639138daf11803c69a516a6bc54fde67d7","events":[{"content_ref":null,"id":"a4e9b954522749e540d45324:0","kind":"state","metadata":{"status":"running"},"sequence":0},{"content_ref":null,"id":"a4e9b954522749e540d45324:1","kind":"context","metadata":{"message_count":1,"policy":"relevance","retained_tools":0},"sequence":1},{"content_ref":null,"id":"a4e9b954522749e540d45324:2","kind":"model_request","metadata":{},"sequence":2},{"content_ref":null,"id":"a4e9b954522749e540d45324:3","kind":"model_response","metadata":{},"sequence":3},{"content_ref":null,"id":"a4e9b954522749e540d45324:4","kind":"state","metadata":{"status":"completed"},"sequence":4},{"content_ref":null,"id":"a4e9b954522749e540d45324:5","kind":"evaluator","metadata":{"evaluator":"exact-v1","score":0,"status":"fail"},"sequence":5},{"content_ref":null,"id":"a4e9b954522749e540d45324:6","kind":"measurements","metadata":{"sources":{"cpu_seconds":"measured:process_time/harness-only","inference_seconds":"reported:backend/prompt+generation","peak_ram_bytes":"sampled:/proc/VmRSS/harness+ollama-process-tree/200ms","peak_vram_bytes":"sampled:nvidia-smi/ollama-process-tree-allocations/200ms","setup_seconds":"reported:backend/model-load","tool_seconds":"measured:perf_counter/tool-boundaries","wall_seconds":"measured:perf_counter/end-to-end"},"values":{"cpu_seconds":0.07655700299999779,"cpu_utilization":null,"energy_joules":null,"gpu_seconds":null,"gpu_utilization":null,"inference_seconds":0.26086899999999996,"peak_ram_bytes":1089523712,"peak_vram_bytes":4922015744,"setup_seconds":0.131189828,"tool_seconds":0,"wall_seconds":0.5037211830003798}},"sequence":6},{"content_ref":null,"id":"a4e9b954522749e540d45324:7","kind":"artifact","metadata":{"path":"output.json","sha256":"e4accc79aab8cfb76f2409bdc9e22d5efa1bf7105a53c47ad8bd55d6e5f0648d"},"sequence":7}],"parent_run_id":null,"replayable":false,"run_id":"a4e9b954522749e540d45324","schema_version":1,"task_id":"held-sum"}
