{"artifacts":{"output.json":"8d22db030396e23a41d7c4eeee484afa48e90c27bb46291c273188af8189b941"},"configuration_id":"0c5c512577ebfa7d3dcc29afa12c0fa17233b023f86d31d3ebb2463866474b97","events":[{"content_ref":null,"id":"df02704734c90e77dc0107d6:0","kind":"state","metadata":{"status":"running"},"sequence":0},{"content_ref":null,"id":"df02704734c90e77dc0107d6:1","kind":"context","metadata":{"message_count":1,"policy":"full","retained_tools":0},"sequence":1},{"content_ref":null,"id":"df02704734c90e77dc0107d6:2","kind":"model_request","metadata":{},"sequence":2},{"content_ref":null,"id":"df02704734c90e77dc0107d6:3","kind":"model_response","metadata":{},"sequence":3},{"content_ref":null,"id":"df02704734c90e77dc0107d6:4","kind":"tool_request","metadata":{},"sequence":4},{"content_ref":null,"id":"df02704734c90e77dc0107d6:5","kind":"tool_result","metadata":{},"sequence":5},{"content_ref":null,"id":"df02704734c90e77dc0107d6:6","kind":"context","metadata":{"message_count":3,"policy":"full","retained_tools":1},"sequence":6},{"content_ref":null,"id":"df02704734c90e77dc0107d6:7","kind":"model_request","metadata":{},"sequence":7},{"content_ref":null,"id":"df02704734c90e77dc0107d6:8","kind":"model_response","metadata":{},"sequence":8},{"content_ref":null,"id":"df02704734c90e77dc0107d6:9","kind":"state","metadata":{"status":"completed"},"sequence":9},{"content_ref":null,"id":"df02704734c90e77dc0107d6:10","kind":"evaluator","metadata":{"evaluator":"exact-v1","score":1,"status":"pass"},"sequence":10},{"content_ref":null,"id":"df02704734c90e77dc0107d6:11","kind":"measurements","metadata":{"sources":{"cpu_seconds":"measured:process_time/harness-only","inference_seconds":"reported:backend/prompt+generation","peak_ram_bytes":"sampled:/proc/VmRSS/harness+ollama-process-tree/200ms","peak_vram_bytes":"sampled:nvidia-smi/ollama-process-tree-allocations/200ms","setup_seconds":"reported:backend/model-load","tool_seconds":"measured:perf_counter/tool-boundaries","wall_seconds":"measured:perf_counter/end-to-end"},"values":{"cpu_seconds":0.2257263359999997,"cpu_utilization":null,"energy_joules":null,"gpu_seconds":null,"gpu_utilization":null,"inference_seconds":1.164638999,"peak_ram_bytes":919179264,"peak_vram_bytes":4922015744,"setup_seconds":0.265194924,"tool_seconds":1.752299976942595e-05,"wall_seconds":1.5906397420003486}},"sequence":11},{"content_ref":null,"id":"df02704734c90e77dc0107d6:12","kind":"artifact","metadata":{"path":"output.json","sha256":"8d22db030396e23a41d7c4eeee484afa48e90c27bb46291c273188af8189b941"},"sequence":12}],"parent_run_id":null,"replayable":false,"run_id":"df02704734c90e77dc0107d6","schema_version":1,"task_id":"repair-add"}
