{"artifacts":{"output.json":"8d22db030396e23a41d7c4eeee484afa48e90c27bb46291c273188af8189b941"},"configuration_id":"48de4c2ff601e3f9a4535cd2973db80780b1990f0e5eee6484eee8db0fd35e5d","events":[{"content_ref":null,"id":"8e410d1ced882004e1509ad5:0","kind":"state","metadata":{"status":"running"},"sequence":0},{"content_ref":null,"id":"8e410d1ced882004e1509ad5:1","kind":"context","metadata":{"message_count":1,"policy":"full","retained_tools":0},"sequence":1},{"content_ref":null,"id":"8e410d1ced882004e1509ad5:2","kind":"model_request","metadata":{},"sequence":2},{"content_ref":null,"id":"8e410d1ced882004e1509ad5:3","kind":"model_response","metadata":{},"sequence":3},{"content_ref":null,"id":"8e410d1ced882004e1509ad5:4","kind":"tool_request","metadata":{},"sequence":4},{"content_ref":null,"id":"8e410d1ced882004e1509ad5:5","kind":"tool_result","metadata":{},"sequence":5},{"content_ref":null,"id":"8e410d1ced882004e1509ad5:6","kind":"context","metadata":{"message_count":3,"policy":"full","retained_tools":1},"sequence":6},{"content_ref":null,"id":"8e410d1ced882004e1509ad5:7","kind":"model_request","metadata":{},"sequence":7},{"content_ref":null,"id":"8e410d1ced882004e1509ad5:8","kind":"model_response","metadata":{},"sequence":8},{"content_ref":null,"id":"8e410d1ced882004e1509ad5:9","kind":"state","metadata":{"status":"completed"},"sequence":9},{"content_ref":null,"id":"8e410d1ced882004e1509ad5:10","kind":"evaluator","metadata":{"evaluator":"exact-v1","score":1,"status":"pass"},"sequence":10},{"content_ref":null,"id":"8e410d1ced882004e1509ad5:11","kind":"measurements","metadata":{"sources":{"cpu_seconds":"measured:process_time/harness-only","inference_seconds":"reported:backend/prompt+generation","peak_ram_bytes":"sampled:/proc/VmRSS/harness+ollama-process-tree/200ms","peak_vram_bytes":"sampled:nvidia-smi/ollama-process-tree-allocations/200ms","setup_seconds":"reported:backend/model-load","tool_seconds":"measured:perf_counter/tool-boundaries","wall_seconds":"measured:perf_counter/end-to-end"},"values":{"cpu_seconds":0.21092395400000008,"cpu_utilization":null,"energy_joules":null,"gpu_seconds":null,"gpu_utilization":null,"inference_seconds":1.1523739990000001,"peak_ram_bytes":924942336,"peak_vram_bytes":4922015744,"setup_seconds":0.268875263,"tool_seconds":2.1060001017758623e-05,"wall_seconds":1.5691830979994847}},"sequence":11},{"content_ref":null,"id":"8e410d1ced882004e1509ad5:12","kind":"artifact","metadata":{"path":"output.json","sha256":"8d22db030396e23a41d7c4eeee484afa48e90c27bb46291c273188af8189b941"},"sequence":12}],"parent_run_id":null,"replayable":false,"run_id":"8e410d1ced882004e1509ad5","schema_version":1,"task_id":"repair-add"}
