{"artifacts":{"output.json":"cc4a8c2376b02a1ca43961006c4407e9fbcd2bed443ba400bdffc8646a424156"},"configuration_id":"3bcd4b6b6dfa179e28b53934d2617e9b575d7134ad11ee5b4a71400e433d65d7","events":[{"content_ref":null,"id":"cc4878318e137b675a5094c3:0","kind":"state","metadata":{"status":"running"},"sequence":0},{"content_ref":null,"id":"cc4878318e137b675a5094c3:1","kind":"context","metadata":{"message_count":1,"policy":"full","retained_tools":0},"sequence":1},{"content_ref":null,"id":"cc4878318e137b675a5094c3:2","kind":"model_request","metadata":{},"sequence":2},{"content_ref":null,"id":"cc4878318e137b675a5094c3:3","kind":"model_response","metadata":{},"sequence":3},{"content_ref":null,"id":"cc4878318e137b675a5094c3:4","kind":"tool_request","metadata":{},"sequence":4},{"content_ref":null,"id":"cc4878318e137b675a5094c3:5","kind":"tool_result","metadata":{},"sequence":5},{"content_ref":null,"id":"cc4878318e137b675a5094c3:6","kind":"tool_request","metadata":{},"sequence":6},{"content_ref":null,"id":"cc4878318e137b675a5094c3:7","kind":"tool_result","metadata":{},"sequence":7},{"content_ref":null,"id":"cc4878318e137b675a5094c3:8","kind":"tool_request","metadata":{},"sequence":8},{"content_ref":null,"id":"cc4878318e137b675a5094c3:9","kind":"tool_result","metadata":{},"sequence":9},{"content_ref":null,"id":"cc4878318e137b675a5094c3:10","kind":"context","metadata":{"message_count":5,"policy":"full","retained_tools":3},"sequence":10},{"content_ref":null,"id":"cc4878318e137b675a5094c3:11","kind":"model_request","metadata":{},"sequence":11},{"content_ref":null,"id":"cc4878318e137b675a5094c3:12","kind":"model_response","metadata":{},"sequence":12},{"content_ref":null,"id":"cc4878318e137b675a5094c3:13","kind":"state","metadata":{"status":"completed"},"sequence":13},{"content_ref":null,"id":"cc4878318e137b675a5094c3:14","kind":"evaluator","metadata":{"evaluator":"exact-v1","score":1,"status":"pass"},"sequence":14},{"content_ref":null,"id":"cc4878318e137b675a5094c3:15","kind":"measurements","metadata":{"sources":{"cpu_seconds":"measured:process_time/harness-only","inference_seconds":"reported:backend/prompt+generation","peak_ram_bytes":"sampled:/proc/VmRSS/harness+ollama-process-tree/200ms","peak_vram_bytes":"sampled:nvidia-smi/ollama-process-tree-allocations/200ms","setup_seconds":"reported:backend/model-load","tool_seconds":"measured:perf_counter/tool-boundaries","wall_seconds":"measured:perf_counter/end-to-end"},"values":{"cpu_seconds":0.4246099520000002,"cpu_utilization":null,"energy_joules":null,"gpu_seconds":null,"gpu_utilization":null,"inference_seconds":1.65666,"peak_ram_bytes":874246144,"peak_vram_bytes":4919918592,"setup_seconds":0.26184321499999996,"tool_seconds":3.0557999707525596e-05,"wall_seconds":2.0382861830003094}},"sequence":15},{"content_ref":null,"id":"cc4878318e137b675a5094c3:16","kind":"artifact","metadata":{"path":"output.json","sha256":"cc4a8c2376b02a1ca43961006c4407e9fbcd2bed443ba400bdffc8646a424156"},"sequence":16}],"parent_run_id":"7bbccc67c1d0a29f8f799227","replayable":false,"run_id":"cc4878318e137b675a5094c3","schema_version":1,"task_id":"batch-sum"}
