{"artifacts":{"output.json":"cc4a8c2376b02a1ca43961006c4407e9fbcd2bed443ba400bdffc8646a424156"},"configuration_id":"0c5c512577ebfa7d3dcc29afa12c0fa17233b023f86d31d3ebb2463866474b97","events":[{"content_ref":null,"id":"70ee8035e42ca85dad6f1da5:0","kind":"state","metadata":{"status":"running"},"sequence":0},{"content_ref":null,"id":"70ee8035e42ca85dad6f1da5:1","kind":"context","metadata":{"message_count":1,"policy":"full","retained_tools":0},"sequence":1},{"content_ref":null,"id":"70ee8035e42ca85dad6f1da5:2","kind":"model_request","metadata":{},"sequence":2},{"content_ref":null,"id":"70ee8035e42ca85dad6f1da5:3","kind":"model_response","metadata":{},"sequence":3},{"content_ref":null,"id":"70ee8035e42ca85dad6f1da5:4","kind":"tool_request","metadata":{},"sequence":4},{"content_ref":null,"id":"70ee8035e42ca85dad6f1da5:5","kind":"tool_result","metadata":{},"sequence":5},{"content_ref":null,"id":"70ee8035e42ca85dad6f1da5:6","kind":"tool_request","metadata":{},"sequence":6},{"content_ref":null,"id":"70ee8035e42ca85dad6f1da5:7","kind":"tool_result","metadata":{},"sequence":7},{"content_ref":null,"id":"70ee8035e42ca85dad6f1da5:8","kind":"tool_request","metadata":{},"sequence":8},{"content_ref":null,"id":"70ee8035e42ca85dad6f1da5:9","kind":"tool_result","metadata":{},"sequence":9},{"content_ref":null,"id":"70ee8035e42ca85dad6f1da5:10","kind":"context","metadata":{"message_count":5,"policy":"full","retained_tools":3},"sequence":10},{"content_ref":null,"id":"70ee8035e42ca85dad6f1da5:11","kind":"model_request","metadata":{},"sequence":11},{"content_ref":null,"id":"70ee8035e42ca85dad6f1da5:12","kind":"model_response","metadata":{},"sequence":12},{"content_ref":null,"id":"70ee8035e42ca85dad6f1da5:13","kind":"state","metadata":{"status":"completed"},"sequence":13},{"content_ref":null,"id":"70ee8035e42ca85dad6f1da5:14","kind":"evaluator","metadata":{"evaluator":"exact-v1","score":1,"status":"pass"},"sequence":14},{"content_ref":null,"id":"70ee8035e42ca85dad6f1da5:15","kind":"measurements","metadata":{"sources":{"cpu_seconds":"measured:process_time/harness-only","inference_seconds":"reported:backend/prompt+generation","peak_ram_bytes":"sampled:/proc/VmRSS/harness+ollama-process-tree/200ms","peak_vram_bytes":"sampled:nvidia-smi/ollama-process-tree-allocations/200ms","setup_seconds":"reported:backend/model-load","tool_seconds":"measured:perf_counter/tool-boundaries","wall_seconds":"measured:perf_counter/end-to-end"},"values":{"cpu_seconds":0.239082986,"cpu_utilization":null,"energy_joules":null,"gpu_seconds":null,"gpu_utilization":null,"inference_seconds":1.6467859999999999,"peak_ram_bytes":874266624,"peak_vram_bytes":4919918592,"setup_seconds":0.260520174,"tool_seconds":3.2871999792405404e-05,"wall_seconds":2.0375096870011475}},"sequence":15},{"content_ref":null,"id":"70ee8035e42ca85dad6f1da5:16","kind":"artifact","metadata":{"path":"output.json","sha256":"cc4a8c2376b02a1ca43961006c4407e9fbcd2bed443ba400bdffc8646a424156"},"sequence":16}],"parent_run_id":null,"replayable":false,"run_id":"70ee8035e42ca85dad6f1da5","schema_version":1,"task_id":"batch-sum"}
