{"artifacts":{"output.json":"01e7c39f63f8704b0b25a1cac316a8e9ad2e6d4f77bf91beeec3d5494506a392"},"configuration_id":"6855169e785d69a1a18b62f30d9f9393b71b56468b3f51f4177970939301e833","events":[{"content_ref":null,"id":"3f6054c70546a68ce272f9f1:0","kind":"state","metadata":{"status":"running"},"sequence":0},{"content_ref":null,"id":"3f6054c70546a68ce272f9f1:1","kind":"model_request","metadata":{},"sequence":1},{"content_ref":null,"id":"3f6054c70546a68ce272f9f1:2","kind":"model_response","metadata":{},"sequence":2},{"content_ref":null,"id":"3f6054c70546a68ce272f9f1:3","kind":"failure","metadata":{"category":"RuntimeFailure"},"sequence":3},{"content_ref":null,"id":"3f6054c70546a68ce272f9f1:4","kind":"failure","metadata":{"category":"RuntimeFailure"},"sequence":4},{"content_ref":null,"id":"3f6054c70546a68ce272f9f1:5","kind":"evaluator","metadata":{"evaluator":"exact-v1","score":null,"status":"error"},"sequence":5},{"content_ref":null,"id":"3f6054c70546a68ce272f9f1:6","kind":"measurements","metadata":{"sources":{"cpu_seconds":"measured:process_time/harness-only","inference_seconds":"reported:backend/prompt+generation","peak_ram_bytes":"sampled:/proc/VmRSS/harness+ollama-process-tree/200ms","peak_vram_bytes":"sampled:nvidia-smi/ollama-process-tree-allocations/200ms","setup_seconds":"reported:backend/model-load","tool_seconds":"measured:perf_counter/tool-boundaries","wall_seconds":"measured:perf_counter/end-to-end"},"values":{"cpu_seconds":0.21661105999999997,"cpu_utilization":null,"energy_joules":null,"gpu_seconds":null,"gpu_utilization":null,"inference_seconds":0.910548,"peak_ram_bytes":740020224,"peak_vram_bytes":0,"setup_seconds":0.139831317,"tool_seconds":0,"wall_seconds":1.1698199410002417}},"sequence":6},{"content_ref":null,"id":"3f6054c70546a68ce272f9f1:7","kind":"artifact","metadata":{"path":"output.json","sha256":"01e7c39f63f8704b0b25a1cac316a8e9ad2e6d4f77bf91beeec3d5494506a392"},"sequence":7}],"parent_run_id":null,"replayable":false,"run_id":"3f6054c70546a68ce272f9f1","schema_version":1,"task_id":"sum"}
