{"artifacts":{"output.json":"cc4a8c2376b02a1ca43961006c4407e9fbcd2bed443ba400bdffc8646a424156"},"configuration_id":"166fae7d3cdd69587ced70edd9a497d36786e9092849dd73c8ed3e6a9252109f","events":[{"content_ref":null,"id":"74ef3b36ed3b96f1ce78e3ab:0","kind":"state","metadata":{"status":"running"},"sequence":0},{"content_ref":null,"id":"74ef3b36ed3b96f1ce78e3ab:1","kind":"context","metadata":{"message_count":1,"policy":"full","retained_tools":0},"sequence":1},{"content_ref":null,"id":"74ef3b36ed3b96f1ce78e3ab:2","kind":"model_request","metadata":{},"sequence":2},{"content_ref":null,"id":"74ef3b36ed3b96f1ce78e3ab:3","kind":"model_response","metadata":{},"sequence":3},{"content_ref":null,"id":"74ef3b36ed3b96f1ce78e3ab:4","kind":"tool_request","metadata":{},"sequence":4},{"content_ref":null,"id":"74ef3b36ed3b96f1ce78e3ab:5","kind":"tool_result","metadata":{},"sequence":5},{"content_ref":null,"id":"74ef3b36ed3b96f1ce78e3ab:6","kind":"tool_request","metadata":{},"sequence":6},{"content_ref":null,"id":"74ef3b36ed3b96f1ce78e3ab:7","kind":"tool_result","metadata":{},"sequence":7},{"content_ref":null,"id":"74ef3b36ed3b96f1ce78e3ab:8","kind":"tool_request","metadata":{},"sequence":8},{"content_ref":null,"id":"74ef3b36ed3b96f1ce78e3ab:9","kind":"tool_result","metadata":{},"sequence":9},{"content_ref":null,"id":"74ef3b36ed3b96f1ce78e3ab:10","kind":"context","metadata":{"message_count":5,"policy":"full","retained_tools":3},"sequence":10},{"content_ref":null,"id":"74ef3b36ed3b96f1ce78e3ab:11","kind":"model_request","metadata":{},"sequence":11},{"content_ref":null,"id":"74ef3b36ed3b96f1ce78e3ab:12","kind":"model_response","metadata":{},"sequence":12},{"content_ref":null,"id":"74ef3b36ed3b96f1ce78e3ab:13","kind":"state","metadata":{"status":"completed"},"sequence":13},{"content_ref":null,"id":"74ef3b36ed3b96f1ce78e3ab:14","kind":"evaluator","metadata":{"evaluator":"exact-v1","score":1,"status":"pass"},"sequence":14},{"content_ref":null,"id":"74ef3b36ed3b96f1ce78e3ab:15","kind":"measurements","metadata":{"sources":{"cpu_seconds":"measured:process_time/harness-only","inference_seconds":"reported:backend/prompt+generation","peak_ram_bytes":"sampled:/proc/VmRSS/harness+ollama-process-tree/200ms","peak_vram_bytes":"sampled:nvidia-smi/ollama-process-tree-allocations/200ms","setup_seconds":"reported:backend/model-load","tool_seconds":"measured:perf_counter/tool-boundaries","wall_seconds":"measured:perf_counter/end-to-end"},"values":{"cpu_seconds":0.4244441339999998,"cpu_utilization":null,"energy_joules":null,"gpu_seconds":null,"gpu_utilization":null,"inference_seconds":1.6730450000000001,"peak_ram_bytes":876412928,"peak_vram_bytes":4919918592,"setup_seconds":0.26250260599999997,"tool_seconds":3.838200063910335e-05,"wall_seconds":2.0553666470004828}},"sequence":15},{"content_ref":null,"id":"74ef3b36ed3b96f1ce78e3ab:16","kind":"artifact","metadata":{"path":"output.json","sha256":"cc4a8c2376b02a1ca43961006c4407e9fbcd2bed443ba400bdffc8646a424156"},"sequence":16}],"parent_run_id":"83773fda760885db86cc44bf","replayable":false,"run_id":"74ef3b36ed3b96f1ce78e3ab","schema_version":1,"task_id":"batch-sum"}
