{"artifacts":{"output.json":"cb65e1a49ef8d22157842d6e02d61ee952ce09f70796ffe21785266e8075b456"},"configuration_id":"e04e4af8ccc75c166dd7d4ad6493555d8bb9aaf7977dff61785eefb419fff1c2","events":[{"content_ref":null,"id":"8447211bd078caab3e5282f6:0","kind":"state","metadata":{"status":"running"},"sequence":0},{"content_ref":null,"id":"8447211bd078caab3e5282f6:1","kind":"context","metadata":{"message_count":1,"policy":"full","retained_tools":0},"sequence":1},{"content_ref":null,"id":"8447211bd078caab3e5282f6:2","kind":"model_request","metadata":{},"sequence":2},{"content_ref":null,"id":"8447211bd078caab3e5282f6:3","kind":"model_response","metadata":{},"sequence":3},{"content_ref":null,"id":"8447211bd078caab3e5282f6:4","kind":"state","metadata":{"status":"completed"},"sequence":4},{"content_ref":null,"id":"8447211bd078caab3e5282f6:5","kind":"evaluator","metadata":{"evaluator":"exact-v1","score":0,"status":"fail"},"sequence":5},{"content_ref":null,"id":"8447211bd078caab3e5282f6:6","kind":"measurements","metadata":{"sources":{"cpu_seconds":"measured:process_time/harness-only","inference_seconds":"reported:backend/prompt+generation","peak_ram_bytes":"sampled:/proc/VmRSS/harness+ollama-process-tree/200ms","peak_vram_bytes":"sampled:nvidia-smi/ollama-process-tree-allocations/200ms","setup_seconds":"reported:backend/model-load","tool_seconds":"measured:perf_counter/tool-boundaries","wall_seconds":"measured:perf_counter/end-to-end"},"values":{"cpu_seconds":0.2942739430000003,"cpu_utilization":null,"energy_joules":null,"gpu_seconds":null,"gpu_utilization":null,"inference_seconds":0.559362,"peak_ram_bytes":1436188672,"peak_vram_bytes":4919918592,"setup_seconds":0.130141925,"tool_seconds":0,"wall_seconds":0.8288994590002403}},"sequence":6},{"content_ref":null,"id":"8447211bd078caab3e5282f6:7","kind":"artifact","metadata":{"path":"output.json","sha256":"cb65e1a49ef8d22157842d6e02d61ee952ce09f70796ffe21785266e8075b456"},"sequence":7}],"parent_run_id":"fdbccfb3fac2101a09aec6f6","replayable":false,"run_id":"8447211bd078caab3e5282f6","schema_version":1,"task_id":"batch-sum"}
