{"artifacts":{"output.json":"a87451faba473a023af5ac51625dbde301f680a4e66c168ef4851dde6c551479"},"configuration_id":"f779cc41ad2ba34075bbf114c12187a7dde5040b77f6218c712ee9639302e474","events":[{"content_ref":null,"id":"5595dfa59b50a2d31c970fa0:0","kind":"state","metadata":{"status":"running"},"sequence":0},{"content_ref":null,"id":"5595dfa59b50a2d31c970fa0:1","kind":"model_request","metadata":{},"sequence":1},{"content_ref":null,"id":"5595dfa59b50a2d31c970fa0:2","kind":"model_response","metadata":{},"sequence":2},{"content_ref":null,"id":"5595dfa59b50a2d31c970fa0:3","kind":"state","metadata":{"status":"completed"},"sequence":3},{"content_ref":null,"id":"5595dfa59b50a2d31c970fa0:4","kind":"evaluator","metadata":{"evaluator":"exact-v1","score":0,"status":"fail"},"sequence":4},{"content_ref":null,"id":"5595dfa59b50a2d31c970fa0:5","kind":"measurements","metadata":{"sources":{"cpu_seconds":"measured:process_time/harness-only","inference_seconds":"reported:backend/prompt+generation","peak_ram_bytes":"sampled:/proc/VmRSS/harness+ollama-process-tree/200ms","peak_vram_bytes":"sampled:nvidia-smi/ollama-process-tree-allocations/200ms","setup_seconds":"reported:backend/model-load","tool_seconds":"measured:perf_counter/tool-boundaries","wall_seconds":"measured:perf_counter/end-to-end"},"values":{"cpu_seconds":0.10649545199999721,"cpu_utilization":null,"energy_joules":null,"gpu_seconds":null,"gpu_utilization":null,"inference_seconds":0.081755,"peak_ram_bytes":781832192,"peak_vram_bytes":782237696,"setup_seconds":0.152476018,"tool_seconds":0,"wall_seconds":0.3752739429992289}},"sequence":5},{"content_ref":null,"id":"5595dfa59b50a2d31c970fa0:6","kind":"artifact","metadata":{"path":"output.json","sha256":"a87451faba473a023af5ac51625dbde301f680a4e66c168ef4851dde6c551479"},"sequence":6}],"parent_run_id":null,"replayable":false,"run_id":"5595dfa59b50a2d31c970fa0","schema_version":1,"task_id":"index-changes"}
