{"artifacts":{"output.json":"4de9e684b486444f93c6d1f44d28edabb49bc93f3ea3dd249bb13d96bb436c94"},"configuration_id":"8dad2c4413bbe61b84dd383e519a9e178b45bf7fe854a76b8756cdfb6c0b1a51","events":[{"content_ref":null,"id":"8513e82b772d6424fe23d086:0","kind":"state","metadata":{"status":"running"},"sequence":0},{"content_ref":null,"id":"8513e82b772d6424fe23d086:1","kind":"context","metadata":{"message_count":1,"policy":"relevance","retained_tools":0},"sequence":1},{"content_ref":null,"id":"8513e82b772d6424fe23d086:2","kind":"model_request","metadata":{},"sequence":2},{"content_ref":null,"id":"8513e82b772d6424fe23d086:3","kind":"model_response","metadata":{},"sequence":3},{"content_ref":null,"id":"8513e82b772d6424fe23d086:4","kind":"tool_request","metadata":{},"sequence":4},{"content_ref":null,"id":"8513e82b772d6424fe23d086:5","kind":"tool_result","metadata":{},"sequence":5},{"content_ref":null,"id":"8513e82b772d6424fe23d086:6","kind":"context","metadata":{"message_count":3,"policy":"relevance","retained_tools":1},"sequence":6},{"content_ref":null,"id":"8513e82b772d6424fe23d086:7","kind":"model_request","metadata":{},"sequence":7},{"content_ref":null,"id":"8513e82b772d6424fe23d086:8","kind":"model_response","metadata":{},"sequence":8},{"content_ref":null,"id":"8513e82b772d6424fe23d086:9","kind":"state","metadata":{"status":"completed"},"sequence":9},{"content_ref":null,"id":"8513e82b772d6424fe23d086:10","kind":"evaluator","metadata":{"evaluator":"exact-v1","score":1,"status":"pass"},"sequence":10},{"content_ref":null,"id":"8513e82b772d6424fe23d086:11","kind":"measurements","metadata":{"sources":{"cpu_seconds":"measured:process_time/harness-only","inference_seconds":"reported:backend/prompt+generation","peak_ram_bytes":"sampled:/proc/VmRSS/harness+ollama-process-tree/200ms","peak_vram_bytes":"sampled:nvidia-smi/ollama-process-tree-allocations/200ms","setup_seconds":"reported:backend/model-load","tool_seconds":"measured:perf_counter/tool-boundaries","wall_seconds":"measured:perf_counter/end-to-end"},"values":{"cpu_seconds":0.1823575119999994,"cpu_utilization":null,"energy_joules":null,"gpu_seconds":null,"gpu_utilization":null,"inference_seconds":1.098388,"peak_ram_bytes":976789504,"peak_vram_bytes":4922015744,"setup_seconds":0.275653885,"tool_seconds":1.991800127143506e-05,"wall_seconds":1.4972696029999497}},"sequence":11},{"content_ref":null,"id":"8513e82b772d6424fe23d086:12","kind":"artifact","metadata":{"path":"output.json","sha256":"4de9e684b486444f93c6d1f44d28edabb49bc93f3ea3dd249bb13d96bb436c94"},"sequence":12}],"parent_run_id":null,"replayable":false,"run_id":"8513e82b772d6424fe23d086","schema_version":1,"task_id":"retrieve-fact"}
