{"artifacts":{"output.json":"cc4a8c2376b02a1ca43961006c4407e9fbcd2bed443ba400bdffc8646a424156"},"configuration_id":"983826a1d95a6b9762742df53c0bd8b86bae4139896fe15a83159d99c68549f5","events":[{"content_ref":null,"id":"afa13e9c25653dfa562a8599:0","kind":"state","metadata":{"status":"running"},"sequence":0},{"content_ref":null,"id":"afa13e9c25653dfa562a8599:1","kind":"context","metadata":{"message_count":1,"policy":"full","retained_tools":0},"sequence":1},{"content_ref":null,"id":"afa13e9c25653dfa562a8599:2","kind":"model_request","metadata":{},"sequence":2},{"content_ref":null,"id":"afa13e9c25653dfa562a8599:3","kind":"routing","metadata":{"budget_remaining":16,"completed_tools":0,"model_digest":"dae161e27b0e90dd1856c8bb3209201fd6736d8eb66298e75ed87571486f4364","reason":"policy-selection","stage":"strong"},"sequence":3},{"content_ref":null,"id":"afa13e9c25653dfa562a8599:4","kind":"child","metadata":{"child_id":"routing:1","kind":"model_request","model_digest":"dae161e27b0e90dd1856c8bb3209201fd6736d8eb66298e75ed87571486f4364","stage":"strong"},"sequence":4},{"content_ref":null,"id":"afa13e9c25653dfa562a8599:5","kind":"child","metadata":{"child_id":"routing:1","kind":"model_response","stage":"strong"},"sequence":5},{"content_ref":null,"id":"afa13e9c25653dfa562a8599:6","kind":"model_response","metadata":{},"sequence":6},{"content_ref":null,"id":"afa13e9c25653dfa562a8599:7","kind":"tool_request","metadata":{},"sequence":7},{"content_ref":null,"id":"afa13e9c25653dfa562a8599:8","kind":"tool_result","metadata":{},"sequence":8},{"content_ref":null,"id":"afa13e9c25653dfa562a8599:9","kind":"tool_request","metadata":{},"sequence":9},{"content_ref":null,"id":"afa13e9c25653dfa562a8599:10","kind":"tool_result","metadata":{},"sequence":10},{"content_ref":null,"id":"afa13e9c25653dfa562a8599:11","kind":"tool_request","metadata":{},"sequence":11},{"content_ref":null,"id":"afa13e9c25653dfa562a8599:12","kind":"tool_result","metadata":{},"sequence":12},{"content_ref":null,"id":"afa13e9c25653dfa562a8599:13","kind":"context","metadata":{"message_count":5,"policy":"full","retained_tools":3},"sequence":13},{"content_ref":null,"id":"afa13e9c25653dfa562a8599:14","kind":"model_request","metadata":{},"sequence":14},{"content_ref":null,"id":"afa13e9c25653dfa562a8599:15","kind":"routing","metadata":{"budget_remaining":15,"completed_tools":3,"model_digest":"4ff64a7f502a08b7616edb8ca0a79eb1853fc363d842b7df4b46915d11a3fb09","reason":"policy-selection","stage":"cheap"},"sequence":15},{"content_ref":null,"id":"afa13e9c25653dfa562a8599:16","kind":"child","metadata":{"child_id":"routing:2","kind":"model_request","model_digest":"4ff64a7f502a08b7616edb8ca0a79eb1853fc363d842b7df4b46915d11a3fb09","stage":"cheap"},"sequence":16},{"content_ref":null,"id":"afa13e9c25653dfa562a8599:17","kind":"child","metadata":{"child_id":"routing:2","kind":"model_response","stage":"cheap"},"sequence":17},{"content_ref":null,"id":"afa13e9c25653dfa562a8599:18","kind":"routing","metadata":{"budget_remaining":14,"completed_tools":3,"model_digest":"dae161e27b0e90dd1856c8bb3209201fd6736d8eb66298e75ed87571486f4364","reason":"malformed-or-failed-response","stage":"strong"},"sequence":18},{"content_ref":null,"id":"afa13e9c25653dfa562a8599:19","kind":"child","metadata":{"child_id":"routing:3","kind":"model_request","model_digest":"dae161e27b0e90dd1856c8bb3209201fd6736d8eb66298e75ed87571486f4364","stage":"strong"},"sequence":19},{"content_ref":null,"id":"afa13e9c25653dfa562a8599:20","kind":"child","metadata":{"child_id":"routing:3","kind":"model_response","stage":"strong"},"sequence":20},{"content_ref":null,"id":"afa13e9c25653dfa562a8599:21","kind":"model_response","metadata":{},"sequence":21},{"content_ref":null,"id":"afa13e9c25653dfa562a8599:22","kind":"state","metadata":{"status":"completed"},"sequence":22},{"content_ref":null,"id":"afa13e9c25653dfa562a8599:23","kind":"evaluator","metadata":{"evaluator":"exact-v1","score":1,"status":"pass"},"sequence":23},{"content_ref":null,"id":"afa13e9c25653dfa562a8599:24","kind":"measurements","metadata":{"sources":{"cpu_seconds":"measured:process_time/harness-only","inference_seconds":"reported:backend/prompt+generation","peak_ram_bytes":"sampled:/proc/VmRSS/harness+ollama-process-tree/200ms","peak_vram_bytes":"sampled:nvidia-smi/ollama-process-tree-allocations/200ms","setup_seconds":"reported:backend/model-load","tool_seconds":"measured:perf_counter/tool-boundaries","wall_seconds":"measured:perf_counter/end-to-end"},"values":{"cpu_seconds":1.121611949,"cpu_utilization":null,"energy_joules":null,"gpu_seconds":null,"gpu_utilization":null,"inference_seconds":6.373005000000001,"peak_ram_bytes":1529511936,"peak_vram_bytes":4919918592,"setup_seconds":0.399186496,"tool_seconds":2.937600038421806e-05,"wall_seconds":6.928331757999331}},"sequence":24},{"content_ref":null,"id":"afa13e9c25653dfa562a8599:25","kind":"artifact","metadata":{"path":"output.json","sha256":"cc4a8c2376b02a1ca43961006c4407e9fbcd2bed443ba400bdffc8646a424156"},"sequence":25}],"parent_run_id":null,"replayable":false,"run_id":"afa13e9c25653dfa562a8599","schema_version":1,"task_id":"batch-sum"}
