{"artifacts":{"output.json":"0e50bd7fa1f81286a0e18c6d37d85d901e7a0469b3c69dbfa31dc980f8a84207"},"configuration_id":"da28dceebace20c6646a1a4b7dcefe66298bcbc2ae225d0140e0a8d6f4b4e7aa","events":[{"content_ref":null,"id":"9e77f5973a9d1308bcfc0b0d:0","kind":"state","metadata":{"status":"running"},"sequence":0},{"content_ref":null,"id":"9e77f5973a9d1308bcfc0b0d:1","kind":"context","metadata":{"message_count":1,"policy":"full","retained_tools":0},"sequence":1},{"content_ref":null,"id":"9e77f5973a9d1308bcfc0b0d:2","kind":"model_request","metadata":{},"sequence":2},{"content_ref":null,"id":"9e77f5973a9d1308bcfc0b0d:3","kind":"model_response","metadata":{},"sequence":3},{"content_ref":null,"id":"9e77f5973a9d1308bcfc0b0d:4","kind":"tool_request","metadata":{},"sequence":4},{"content_ref":null,"id":"9e77f5973a9d1308bcfc0b0d:5","kind":"tool_result","metadata":{},"sequence":5},{"content_ref":null,"id":"9e77f5973a9d1308bcfc0b0d:6","kind":"context","metadata":{"message_count":3,"policy":"full","retained_tools":1},"sequence":6},{"content_ref":null,"id":"9e77f5973a9d1308bcfc0b0d:7","kind":"model_request","metadata":{},"sequence":7},{"content_ref":null,"id":"9e77f5973a9d1308bcfc0b0d:8","kind":"model_response","metadata":{},"sequence":8},{"content_ref":null,"id":"9e77f5973a9d1308bcfc0b0d:9","kind":"state","metadata":{"status":"completed"},"sequence":9},{"content_ref":null,"id":"9e77f5973a9d1308bcfc0b0d:10","kind":"evaluator","metadata":{"evaluator":"exact-v1","score":0,"status":"fail"},"sequence":10},{"content_ref":null,"id":"9e77f5973a9d1308bcfc0b0d:11","kind":"measurements","metadata":{"sources":{"cpu_seconds":"measured:process_time/harness-only","inference_seconds":"reported:backend/prompt+generation","peak_ram_bytes":"sampled:/proc/VmRSS/harness+ollama-process-tree/200ms","peak_vram_bytes":"sampled:nvidia-smi/ollama-process-tree-allocations/200ms","setup_seconds":"reported:backend/model-load","tool_seconds":"measured:perf_counter/tool-boundaries","wall_seconds":"measured:perf_counter/end-to-end"},"values":{"cpu_seconds":0.3162412449999996,"cpu_utilization":null,"energy_joules":null,"gpu_seconds":null,"gpu_utilization":null,"inference_seconds":1.908493,"peak_ram_bytes":1060814848,"peak_vram_bytes":4926210048,"setup_seconds":0.305080282,"tool_seconds":3.8652999137411825e-05,"wall_seconds":2.3636180570010765}},"sequence":11},{"content_ref":null,"id":"9e77f5973a9d1308bcfc0b0d:12","kind":"artifact","metadata":{"path":"output.json","sha256":"0e50bd7fa1f81286a0e18c6d37d85d901e7a0469b3c69dbfa31dc980f8a84207"},"sequence":12}],"parent_run_id":null,"replayable":false,"run_id":"9e77f5973a9d1308bcfc0b0d","schema_version":1,"task_id":"sort-records"}
