{"artifacts":{"selection.json":"62899359a0cc52db727c476f1498ccb4b8b1234c361ec88a543b0cfcb092f585"},"configuration_id":"eecbac40fc9a9cb4382f69e37dd6fe8e7c8f85af41ce175dd628ac657b9b434d","events":[{"content_ref":null,"id":"7bbccc67c1d0a29f8f799227:0","kind":"child","metadata":{"child_id":"candidate:0","kind":"run_start"},"sequence":0},{"content_ref":null,"id":"7bbccc67c1d0a29f8f799227:1","kind":"child","metadata":{"child_id":"cc4878318e137b675a5094c3","kind":"run_complete"},"sequence":1},{"content_ref":null,"id":"7bbccc67c1d0a29f8f799227:2","kind":"evaluator","metadata":{"evaluator":"exact-v1","score":1,"status":"pass"},"sequence":2},{"content_ref":null,"id":"7bbccc67c1d0a29f8f799227:3","kind":"measurements","metadata":{"sources":{"cpu_seconds":"measured:process_time/harness-only","inference_seconds":"reported:sum-all-candidate-inference_seconds","peak_ram_bytes":"sampled:/proc/VmRSS/harness+ollama-process-tree/200ms","peak_vram_bytes":"sampled:nvidia-smi/ollama-process-tree-allocations/200ms","setup_seconds":"reported:sum-all-candidate-setup_seconds","tool_seconds":"reported:sum-all-candidate-tool_seconds","wall_seconds":"measured:perf_counter/end-to-end"},"values":{"cpu_seconds":0.47276752099999975,"cpu_utilization":null,"energy_joules":null,"gpu_seconds":null,"gpu_utilization":null,"inference_seconds":1.65666,"peak_ram_bytes":874229760,"peak_vram_bytes":4919918592,"setup_seconds":0.26184321499999996,"tool_seconds":3.0557999707525596e-05,"wall_seconds":2.126167620999695}},"sequence":3},{"content_ref":null,"id":"7bbccc67c1d0a29f8f799227:4","kind":"artifact","metadata":{"path":"selection.json","sha256":"62899359a0cc52db727c476f1498ccb4b8b1234c361ec88a543b0cfcb092f585"},"sequence":4}],"parent_run_id":null,"replayable":false,"run_id":"7bbccc67c1d0a29f8f799227","schema_version":1,"task_id":"batch-sum"}
