{"artifacts":{"conventions.json":"8b769247a262835b64c1da7224cdb4eca15e65d5e0cad9c60eb14625497580f8","patch.diff":"e3b0c44298fc1c149afbf4c8996fb92427ae41e4649b934ca495991b7852b855","permissions.json":"b5cdb625ab5a122622f5955416983fb195a985c28a3ecf51e18da31a9e51dab0","verification.json":"32e5e9b68aa21760a7e2236f9fc13150bc00def9ce6337e0381eddb53e2c7c5d","workspace/AGENTS.md":"8bf73f4882cf2a8252f0074f34f27b789faa9c8c2612b20522dee34d1c83e073","workspace/pyproject.toml":"2ca10c129844d5f6892088492957c780b58ea2c2f452a1af871d67241d8d34e8","workspace/runtime.py":"8e868c5139cf2f67a396196d9a4b2558608bf25837b30e79651d22220907a780"},"configuration_id":"dbe3a0df462ec0c780f0db6fa4e5c8d36e3086b12193d6feda6f7d6e5f838153","events":[{"content_ref":"0","id":"2a37847ee11172f4fcab94eb:0","kind":"state","metadata":{"status":"running"},"sequence":0},{"content_ref":"1","id":"2a37847ee11172f4fcab94eb:1","kind":"context","metadata":{"message_count":1,"policy":"full","retained_tools":0},"sequence":1},{"content_ref":"2","id":"2a37847ee11172f4fcab94eb:2","kind":"model_request","metadata":{},"sequence":2},{"content_ref":"3","id":"2a37847ee11172f4fcab94eb:3","kind":"model_response","metadata":{},"sequence":3},{"content_ref":"4","id":"2a37847ee11172f4fcab94eb:4","kind":"state","metadata":{"status":"completed"},"sequence":4},{"content_ref":"5","id":"2a37847ee11172f4fcab94eb:5","kind":"evaluator","metadata":{"evaluator":"unknown-usage-properties-v1","score":0,"status":"fail"},"sequence":5},{"content_ref":"6","id":"2a37847ee11172f4fcab94eb:6","kind":"artifact","metadata":{"path":"patch.diff","sha256":"e3b0c44298fc1c149afbf4c8996fb92427ae41e4649b934ca495991b7852b855"},"sequence":6},{"content_ref":"7","id":"2a37847ee11172f4fcab94eb:7","kind":"artifact","metadata":{"path":"verification.json","sha256":"32e5e9b68aa21760a7e2236f9fc13150bc00def9ce6337e0381eddb53e2c7c5d"},"sequence":7},{"content_ref":"8","id":"2a37847ee11172f4fcab94eb:8","kind":"artifact","metadata":{"path":"permissions.json","sha256":"b5cdb625ab5a122622f5955416983fb195a985c28a3ecf51e18da31a9e51dab0"},"sequence":8},{"content_ref":"9","id":"2a37847ee11172f4fcab94eb:9","kind":"artifact","metadata":{"path":"conventions.json","sha256":"8b769247a262835b64c1da7224cdb4eca15e65d5e0cad9c60eb14625497580f8"},"sequence":9},{"content_ref":"10","id":"2a37847ee11172f4fcab94eb:10","kind":"artifact","metadata":{"path":"workspace/runtime.py","sha256":"8e868c5139cf2f67a396196d9a4b2558608bf25837b30e79651d22220907a780"},"sequence":10},{"content_ref":"11","id":"2a37847ee11172f4fcab94eb:11","kind":"artifact","metadata":{"path":"workspace/AGENTS.md","sha256":"8bf73f4882cf2a8252f0074f34f27b789faa9c8c2612b20522dee34d1c83e073"},"sequence":11},{"content_ref":"12","id":"2a37847ee11172f4fcab94eb:12","kind":"artifact","metadata":{"path":"workspace/pyproject.toml","sha256":"2ca10c129844d5f6892088492957c780b58ea2c2f452a1af871d67241d8d34e8"},"sequence":12},{"content_ref":"13","id":"2a37847ee11172f4fcab94eb:13","kind":"measurements","metadata":{"sources":{"cpu_seconds":"measured:process_time/harness-only","inference_seconds":"reported:backend/prompt+generation","peak_ram_bytes":"sampled:/proc/VmRSS/harness+ollama-process-tree/200ms","peak_vram_bytes":"sampled:nvidia-smi/harness+ollama-process-tree/200ms","setup_seconds":"reported:backend/model-load","tool_seconds":"measured:perf_counter/tool-boundaries","wall_seconds":"measured:perf_counter/end-to-end"},"values":{"cpu_seconds":0.37717298599999993,"cpu_utilization":null,"energy_joules":null,"gpu_seconds":null,"gpu_utilization":null,"inference_seconds":3.398254,"peak_ram_bytes":863055872,"peak_vram_bytes":5161091072,"setup_seconds":0.132930209,"tool_seconds":0,"wall_seconds":3.686804363000192}},"sequence":13}],"parent_run_id":null,"replayable":true,"run_id":"2a37847ee11172f4fcab94eb","schema_version":1,"task_id":"repository-unknown-usage"}
