{"artifacts":{"selection.json":"b564c41ecd1e334ce4b9e06d91987a659c5b3adb602e8bd7a6ea71086f0f9e23"},"configuration_id":"6a14b54339d41a695f5370b990f16fc92221faab9149632db365c9d8706f3cd9","events":[{"content_ref":null,"id":"4c8ac10e3c7c402427252940:0","kind":"child","metadata":{"child_id":"candidate:0","kind":"run_start"},"sequence":0},{"content_ref":null,"id":"4c8ac10e3c7c402427252940:1","kind":"child","metadata":{"child_id":"581981dcde06df242fd830c1","kind":"run_complete"},"sequence":1},{"content_ref":null,"id":"4c8ac10e3c7c402427252940:2","kind":"child","metadata":{"child_id":"candidate:1","kind":"run_start"},"sequence":2},{"content_ref":null,"id":"4c8ac10e3c7c402427252940:3","kind":"child","metadata":{"child_id":"ad0a77a4ed2b4d9dc3fcd4f4","kind":"run_complete"},"sequence":3},{"content_ref":null,"id":"4c8ac10e3c7c402427252940:4","kind":"child","metadata":{"child_id":"candidate:2","kind":"run_start"},"sequence":4},{"content_ref":null,"id":"4c8ac10e3c7c402427252940:5","kind":"child","metadata":{"child_id":"2147a2b83ffab56418192e10","kind":"run_complete"},"sequence":5},{"content_ref":null,"id":"4c8ac10e3c7c402427252940:6","kind":"evaluator","metadata":{"evaluator":"exact-v1","score":1,"status":"pass"},"sequence":6},{"content_ref":null,"id":"4c8ac10e3c7c402427252940:7","kind":"measurements","metadata":{"sources":{"cpu_seconds":"measured:process_time/harness-only","inference_seconds":"reported:sum-all-candidate-inference_seconds","peak_ram_bytes":"sampled:/proc/VmRSS/harness+ollama-process-tree/200ms","peak_vram_bytes":"sampled:nvidia-smi/ollama-process-tree-allocations/200ms","setup_seconds":"reported:sum-all-candidate-setup_seconds","tool_seconds":"reported:sum-all-candidate-tool_seconds","wall_seconds":"measured:perf_counter/end-to-end"},"values":{"cpu_seconds":1.3144015089999996,"cpu_utilization":null,"energy_joules":null,"gpu_seconds":null,"gpu_utilization":null,"inference_seconds":3.2954120000000002,"peak_ram_bytes":1435799552,"peak_vram_bytes":4919918592,"setup_seconds":0.522268932,"tool_seconds":3.719999949680641e-05,"wall_seconds":4.291962952000176}},"sequence":7},{"content_ref":null,"id":"4c8ac10e3c7c402427252940:8","kind":"artifact","metadata":{"path":"selection.json","sha256":"b564c41ecd1e334ce4b9e06d91987a659c5b3adb602e8bd7a6ea71086f0f9e23"},"sequence":8}],"parent_run_id":null,"replayable":false,"run_id":"4c8ac10e3c7c402427252940","schema_version":1,"task_id":"batch-sum"}
