{"artifacts":{"output.json":"0184285fca8a016451d57dbc2f6ed2dacd5e66b4807cecd932dfcbbb2603779b"},"configuration_id":"be0ec296c5b8c5b45a8787b8921ca569d29d8e6802acaff511113fa0a71e0b2d","events":[{"content_ref":null,"id":"156874816424689b8a0d5268:0","kind":"state","metadata":{"status":"running"},"sequence":0},{"content_ref":null,"id":"156874816424689b8a0d5268:1","kind":"context","metadata":{"message_count":1,"policy":"full","retained_tools":0},"sequence":1},{"content_ref":null,"id":"156874816424689b8a0d5268:2","kind":"model_request","metadata":{},"sequence":2},{"content_ref":null,"id":"156874816424689b8a0d5268:3","kind":"model_response","metadata":{},"sequence":3},{"content_ref":null,"id":"156874816424689b8a0d5268:4","kind":"state","metadata":{"status":"completed"},"sequence":4},{"content_ref":null,"id":"156874816424689b8a0d5268:5","kind":"evaluator","metadata":{"evaluator":"exact-v1","score":0,"status":"fail"},"sequence":5},{"content_ref":null,"id":"156874816424689b8a0d5268:6","kind":"measurements","metadata":{"sources":{"cpu_seconds":"measured:process_time/harness-only","inference_seconds":"reported:backend/prompt+generation","peak_ram_bytes":"sampled:/proc/VmRSS/harness+ollama-process-tree/200ms","peak_vram_bytes":"sampled:nvidia-smi/harness+ollama-process-tree/200ms","setup_seconds":"reported:backend/model-load","tool_seconds":"measured:perf_counter/tool-boundaries","wall_seconds":"measured:perf_counter/end-to-end"},"values":{"cpu_seconds":0.3409615060000064,"cpu_utilization":null,"energy_joules":null,"gpu_seconds":null,"gpu_utilization":null,"inference_seconds":0.26443746899894904,"peak_ram_bytes":2111692800,"peak_vram_bytes":1398800384,"setup_seconds":0,"tool_seconds":0,"wall_seconds":0.37208049000037136}},"sequence":6},{"content_ref":null,"id":"156874816424689b8a0d5268:7","kind":"artifact","metadata":{"path":"output.json","sha256":"0184285fca8a016451d57dbc2f6ed2dacd5e66b4807cecd932dfcbbb2603779b"},"sequence":7}],"parent_run_id":"c09e0c0c21654e4998728377","replayable":false,"run_id":"156874816424689b8a0d5268","schema_version":1,"task_id":"held-batch-sum"}
