{"artifacts":{"output.json":"cc4a8c2376b02a1ca43961006c4407e9fbcd2bed443ba400bdffc8646a424156"},"configuration_id":"0fe5760e335062e4795fb06185d2f9f421ff094c0a8ef0b23cec1780c86cfe62","events":[{"content_ref":null,"id":"1f114760ee244b62498667fd:0","kind":"state","metadata":{"status":"running"},"sequence":0},{"content_ref":null,"id":"1f114760ee244b62498667fd:1","kind":"context","metadata":{},"sequence":1},{"content_ref":null,"id":"1f114760ee244b62498667fd:2","kind":"model_request","metadata":{},"sequence":2},{"content_ref":null,"id":"1f114760ee244b62498667fd:3","kind":"model_response","metadata":{},"sequence":3},{"content_ref":null,"id":"1f114760ee244b62498667fd:4","kind":"tool_request","metadata":{},"sequence":4},{"content_ref":null,"id":"1f114760ee244b62498667fd:5","kind":"tool_result","metadata":{},"sequence":5},{"content_ref":null,"id":"1f114760ee244b62498667fd:6","kind":"tool_request","metadata":{},"sequence":6},{"content_ref":null,"id":"1f114760ee244b62498667fd:7","kind":"tool_result","metadata":{},"sequence":7},{"content_ref":null,"id":"1f114760ee244b62498667fd:8","kind":"tool_request","metadata":{},"sequence":8},{"content_ref":null,"id":"1f114760ee244b62498667fd:9","kind":"tool_result","metadata":{},"sequence":9},{"content_ref":null,"id":"1f114760ee244b62498667fd:10","kind":"context","metadata":{},"sequence":10},{"content_ref":null,"id":"1f114760ee244b62498667fd:11","kind":"model_request","metadata":{},"sequence":11},{"content_ref":null,"id":"1f114760ee244b62498667fd:12","kind":"model_response","metadata":{},"sequence":12},{"content_ref":null,"id":"1f114760ee244b62498667fd:13","kind":"state","metadata":{"status":"completed"},"sequence":13},{"content_ref":null,"id":"1f114760ee244b62498667fd:14","kind":"evaluator","metadata":{"evaluator":"exact-v1","score":1,"status":"pass"},"sequence":14},{"content_ref":null,"id":"1f114760ee244b62498667fd:15","kind":"measurements","metadata":{"sources":{"cpu_seconds":"measured:process_time/harness-only","inference_seconds":"reported:backend/prompt+generation","peak_ram_bytes":"sampled:/proc/VmRSS/harness+ollama-process-tree/200ms","peak_vram_bytes":"sampled:nvidia-smi/ollama-process-tree-allocations/200ms","setup_seconds":"reported:backend/model-load","tool_seconds":"measured:perf_counter/tool-boundaries","wall_seconds":"measured:perf_counter/end-to-end"},"values":{"cpu_seconds":0.246949133,"cpu_utilization":null,"energy_joules":null,"gpu_seconds":null,"gpu_utilization":null,"inference_seconds":1.646347,"peak_ram_bytes":871796736,"peak_vram_bytes":4919918592,"setup_seconds":0.259649965,"tool_seconds":3.7711000004492234e-05,"wall_seconds":2.0463958999998795}},"sequence":15},{"content_ref":null,"id":"1f114760ee244b62498667fd:16","kind":"artifact","metadata":{"path":"output.json","sha256":"cc4a8c2376b02a1ca43961006c4407e9fbcd2bed443ba400bdffc8646a424156"},"sequence":16}],"parent_run_id":null,"replayable":false,"run_id":"1f114760ee244b62498667fd","schema_version":1,"task_id":"batch-sum"}
