{"artifacts":{"output.json":"cc4a8c2376b02a1ca43961006c4407e9fbcd2bed443ba400bdffc8646a424156"},"configuration_id":"e6339e1d3bd5dc69df6bcd217f92c8df68b68298fe2480e13c12ab9d82c861b3","events":[{"content_ref":null,"id":"ded3d83698ff4b74cffc86cd:0","kind":"state","metadata":{"status":"running"},"sequence":0},{"content_ref":null,"id":"ded3d83698ff4b74cffc86cd:1","kind":"model_request","metadata":{},"sequence":1},{"content_ref":null,"id":"ded3d83698ff4b74cffc86cd:2","kind":"model_response","metadata":{},"sequence":2},{"content_ref":null,"id":"ded3d83698ff4b74cffc86cd:3","kind":"tool_request","metadata":{},"sequence":3},{"content_ref":null,"id":"ded3d83698ff4b74cffc86cd:4","kind":"tool_result","metadata":{},"sequence":4},{"content_ref":null,"id":"ded3d83698ff4b74cffc86cd:5","kind":"tool_request","metadata":{},"sequence":5},{"content_ref":null,"id":"ded3d83698ff4b74cffc86cd:6","kind":"tool_result","metadata":{},"sequence":6},{"content_ref":null,"id":"ded3d83698ff4b74cffc86cd:7","kind":"tool_request","metadata":{},"sequence":7},{"content_ref":null,"id":"ded3d83698ff4b74cffc86cd:8","kind":"tool_result","metadata":{},"sequence":8},{"content_ref":null,"id":"ded3d83698ff4b74cffc86cd:9","kind":"model_request","metadata":{},"sequence":9},{"content_ref":null,"id":"ded3d83698ff4b74cffc86cd:10","kind":"model_response","metadata":{},"sequence":10},{"content_ref":null,"id":"ded3d83698ff4b74cffc86cd:11","kind":"state","metadata":{"status":"completed"},"sequence":11},{"content_ref":null,"id":"ded3d83698ff4b74cffc86cd:12","kind":"evaluator","metadata":{"evaluator":"exact-v1","score":1,"status":"pass"},"sequence":12},{"content_ref":null,"id":"ded3d83698ff4b74cffc86cd:13","kind":"measurements","metadata":{"sources":{"cpu_seconds":"measured:process_time/harness-only","inference_seconds":"reported:backend/prompt+generation","peak_ram_bytes":"sampled:/proc/VmRSS/harness+ollama-process-tree/200ms","peak_vram_bytes":"sampled:nvidia-smi/ollama-process-tree-allocations/200ms","setup_seconds":"reported:backend/model-load","tool_seconds":"measured:perf_counter/tool-boundaries","wall_seconds":"measured:perf_counter/end-to-end"},"values":{"cpu_seconds":0.546040994,"cpu_utilization":null,"energy_joules":null,"gpu_seconds":null,"gpu_utilization":null,"inference_seconds":1.7590999999999999,"peak_ram_bytes":5104037888,"peak_vram_bytes":4919918592,"setup_seconds":3.361794925,"tool_seconds":4.252099915902363e-05,"wall_seconds":5.242154654000842}},"sequence":13},{"content_ref":null,"id":"ded3d83698ff4b74cffc86cd:14","kind":"artifact","metadata":{"path":"output.json","sha256":"cc4a8c2376b02a1ca43961006c4407e9fbcd2bed443ba400bdffc8646a424156"},"sequence":14}],"parent_run_id":null,"replayable":false,"run_id":"ded3d83698ff4b74cffc86cd","schema_version":1,"task_id":"batch-sum"}
