{"artifacts":{"output.json":"7cb52e3bca81c1fc370dfe5fb8f72b17be0f529b001c063d798d73dee497b09d"},"configuration_id":"badf9152d0cbc2681541c609904f36fb2dc14486417d7362a31e16f212b848bf","events":[{"content_ref":null,"id":"ffc0511b7172507b42198fe0:0","kind":"state","metadata":{"status":"running"},"sequence":0},{"content_ref":null,"id":"ffc0511b7172507b42198fe0:1","kind":"model_request","metadata":{},"sequence":1},{"content_ref":null,"id":"ffc0511b7172507b42198fe0:2","kind":"model_response","metadata":{},"sequence":2},{"content_ref":null,"id":"ffc0511b7172507b42198fe0:3","kind":"state","metadata":{"status":"completed"},"sequence":3},{"content_ref":null,"id":"ffc0511b7172507b42198fe0:4","kind":"evaluator","metadata":{"evaluator":"exact-v1","score":0,"status":"fail"},"sequence":4},{"content_ref":null,"id":"ffc0511b7172507b42198fe0:5","kind":"measurements","metadata":{"sources":{"cpu_seconds":"measured:process_time/harness-only","inference_seconds":"reported:backend/prompt+generation","peak_ram_bytes":"sampled:/proc/VmRSS/harness+ollama-process-tree/200ms","peak_vram_bytes":"sampled:nvidia-smi/ollama-process-tree-allocations/200ms","setup_seconds":"reported:backend/model-load","tool_seconds":"measured:perf_counter/tool-boundaries","wall_seconds":"measured:perf_counter/end-to-end"},"values":{"cpu_seconds":0.2707685039999994,"cpu_utilization":null,"energy_joules":null,"gpu_seconds":null,"gpu_utilization":null,"inference_seconds":1.153141,"peak_ram_bytes":737464320,"peak_vram_bytes":0,"setup_seconds":0.144725215,"tool_seconds":0,"wall_seconds":1.4435098879994257}},"sequence":5},{"content_ref":null,"id":"ffc0511b7172507b42198fe0:6","kind":"artifact","metadata":{"path":"output.json","sha256":"7cb52e3bca81c1fc370dfe5fb8f72b17be0f529b001c063d798d73dee497b09d"},"sequence":6}],"parent_run_id":null,"replayable":false,"run_id":"ffc0511b7172507b42198fe0","schema_version":1,"task_id":"sort-records"}
