{"artifacts":{"output.json":"cc4a8c2376b02a1ca43961006c4407e9fbcd2bed443ba400bdffc8646a424156"},"configuration_id":"da28dceebace20c6646a1a4b7dcefe66298bcbc2ae225d0140e0a8d6f4b4e7aa","events":[{"content_ref":"0","id":"266a864a39762174c1bbde4c:0","kind":"state","metadata":{"status":"running"},"sequence":0},{"content_ref":"1","id":"266a864a39762174c1bbde4c:1","kind":"context","metadata":{"message_count":1,"policy":"full","retained_tools":0},"sequence":1},{"content_ref":"2","id":"266a864a39762174c1bbde4c:2","kind":"model_request","metadata":{},"sequence":2},{"content_ref":"3","id":"266a864a39762174c1bbde4c:3","kind":"model_response","metadata":{},"sequence":3},{"content_ref":"4","id":"266a864a39762174c1bbde4c:4","kind":"tool_request","metadata":{"name":"sum"},"sequence":4},{"content_ref":"5","id":"266a864a39762174c1bbde4c:5","kind":"tool_result","metadata":{"name":"sum"},"sequence":5},{"content_ref":"6","id":"266a864a39762174c1bbde4c:6","kind":"tool_request","metadata":{"name":"sum"},"sequence":6},{"content_ref":"7","id":"266a864a39762174c1bbde4c:7","kind":"tool_result","metadata":{"name":"sum"},"sequence":7},{"content_ref":"8","id":"266a864a39762174c1bbde4c:8","kind":"tool_request","metadata":{"name":"sum"},"sequence":8},{"content_ref":"9","id":"266a864a39762174c1bbde4c:9","kind":"tool_result","metadata":{"name":"sum"},"sequence":9},{"content_ref":"10","id":"266a864a39762174c1bbde4c:10","kind":"context","metadata":{"message_count":5,"policy":"full","retained_tools":3},"sequence":10},{"content_ref":"11","id":"266a864a39762174c1bbde4c:11","kind":"model_request","metadata":{},"sequence":11},{"content_ref":"12","id":"266a864a39762174c1bbde4c:12","kind":"model_response","metadata":{},"sequence":12},{"content_ref":"13","id":"266a864a39762174c1bbde4c:13","kind":"state","metadata":{"status":"completed"},"sequence":13},{"content_ref":"14","id":"266a864a39762174c1bbde4c:14","kind":"evaluator","metadata":{"evaluator":"exact-v1","score":1,"status":"pass"},"sequence":14},{"content_ref":"15","id":"266a864a39762174c1bbde4c:15","kind":"measurements","metadata":{"sources":{"cpu_seconds":"measured:process_time/harness-only","inference_seconds":"reported:backend/prompt+generation","peak_ram_bytes":"sampled:/proc/VmRSS/harness+ollama-process-tree/200ms","peak_vram_bytes":"sampled:nvidia-smi/harness+ollama-process-tree/200ms","setup_seconds":"reported:backend/model-load","tool_seconds":"measured:perf_counter/tool-boundaries","wall_seconds":"measured:perf_counter/end-to-end"},"values":{"cpu_seconds":0.23665936799999998,"cpu_utilization":null,"energy_joules":null,"gpu_seconds":null,"gpu_utilization":null,"inference_seconds":1.652253,"peak_ram_bytes":886329344,"peak_vram_bytes":4919918592,"setup_seconds":0.259627097,"tool_seconds":3.261100209783763e-05,"wall_seconds":2.035973014000774}},"sequence":15},{"content_ref":"16","id":"266a864a39762174c1bbde4c:16","kind":"artifact","metadata":{"path":"output.json","sha256":"cc4a8c2376b02a1ca43961006c4407e9fbcd2bed443ba400bdffc8646a424156"},"sequence":16}],"parent_run_id":null,"replayable":true,"run_id":"266a864a39762174c1bbde4c","schema_version":1,"task_id":"batch-sum"}
