{"artifacts":{"conventions.json":"8b769247a262835b64c1da7224cdb4eca15e65d5e0cad9c60eb14625497580f8","patch.diff":"d39499bb3ef38f301525950856d6b7c32d7b9f9da53ff3113a4364d3dda09e8a","permissions.json":"479a5370fde743713eb1c1c3a760e03ba8c03c80b8f935825958cec13ac74713","verification.json":"86548adc0f96a8925aa12dfa2a3a5fd1d0165898c983d834f7f1005ba0883490","workspace/AGENTS.md":"8bf73f4882cf2a8252f0074f34f27b789faa9c8c2612b20522dee34d1c83e073","workspace/pyproject.toml":"2ca10c129844d5f6892088492957c780b58ea2c2f452a1af871d67241d8d34e8","workspace/runtime.py":"83722da688ce38e5d41cbd9c55ec5be79a99f7c7f28a5f0bfa32ef5d2fcdd962"},"configuration_id":"fa636e794e222a68d405c0f6976e567b21bf78178f93e7e3284ce3855297e9a7","events":[{"content_ref":"0","id":"8952376098bcb81e28e4ba88:0","kind":"state","metadata":{"status":"running"},"sequence":0},{"content_ref":"1","id":"8952376098bcb81e28e4ba88:1","kind":"context","metadata":{"message_count":1,"policy":"full","retained_tools":0},"sequence":1},{"content_ref":"2","id":"8952376098bcb81e28e4ba88:2","kind":"model_request","metadata":{},"sequence":2},{"content_ref":"3","id":"8952376098bcb81e28e4ba88:3","kind":"model_response","metadata":{},"sequence":3},{"content_ref":"4","id":"8952376098bcb81e28e4ba88:4","kind":"tool_request","metadata":{},"sequence":4},{"content_ref":"5","id":"8952376098bcb81e28e4ba88:5","kind":"authority","metadata":{"action":"check","allowed":true,"operation":"read","policy_sha256":"de53838f6b87625152e8f660d50389d82097b17a401fa8f9fb1fa5cc05754d8b","resource_sha256":"7ad31a8481a30443855f0ab42b4cac83ba77c8cc48a0c78c3a619711209a0eca","scope":"repositories"},"sequence":5},{"content_ref":"6","id":"8952376098bcb81e28e4ba88:6","kind":"tool_result","metadata":{},"sequence":6},{"content_ref":"7","id":"8952376098bcb81e28e4ba88:7","kind":"context","metadata":{"message_count":3,"policy":"full","retained_tools":1},"sequence":7},{"content_ref":"8","id":"8952376098bcb81e28e4ba88:8","kind":"model_request","metadata":{},"sequence":8},{"content_ref":"9","id":"8952376098bcb81e28e4ba88:9","kind":"model_response","metadata":{},"sequence":9},{"content_ref":"10","id":"8952376098bcb81e28e4ba88:10","kind":"tool_request","metadata":{},"sequence":10},{"content_ref":"11","id":"8952376098bcb81e28e4ba88:11","kind":"authority","metadata":{"action":"check","allowed":true,"operation":"read","policy_sha256":"de53838f6b87625152e8f660d50389d82097b17a401fa8f9fb1fa5cc05754d8b","resource_sha256":"7ad31a8481a30443855f0ab42b4cac83ba77c8cc48a0c78c3a619711209a0eca","scope":"repositories"},"sequence":11},{"content_ref":"12","id":"8952376098bcb81e28e4ba88:12","kind":"authority","metadata":{"action":"check","allowed":true,"operation":"write","policy_sha256":"de53838f6b87625152e8f660d50389d82097b17a401fa8f9fb1fa5cc05754d8b","resource_sha256":"7ad31a8481a30443855f0ab42b4cac83ba77c8cc48a0c78c3a619711209a0eca","scope":"repositories"},"sequence":12},{"content_ref":"13","id":"8952376098bcb81e28e4ba88:13","kind":"tool_result","metadata":{},"sequence":13},{"content_ref":"14","id":"8952376098bcb81e28e4ba88:14","kind":"context","metadata":{"message_count":5,"policy":"full","retained_tools":2},"sequence":14},{"content_ref":"15","id":"8952376098bcb81e28e4ba88:15","kind":"model_request","metadata":{},"sequence":15},{"content_ref":"16","id":"8952376098bcb81e28e4ba88:16","kind":"model_response","metadata":{},"sequence":16},{"content_ref":"17","id":"8952376098bcb81e28e4ba88:17","kind":"tool_request","metadata":{},"sequence":17},{"content_ref":"18","id":"8952376098bcb81e28e4ba88:18","kind":"tool_result","metadata":{},"sequence":18},{"content_ref":"19","id":"8952376098bcb81e28e4ba88:19","kind":"context","metadata":{"message_count":7,"policy":"full","retained_tools":3},"sequence":19},{"content_ref":"20","id":"8952376098bcb81e28e4ba88:20","kind":"model_request","metadata":{},"sequence":20},{"content_ref":"21","id":"8952376098bcb81e28e4ba88:21","kind":"model_response","metadata":{},"sequence":21},{"content_ref":"22","id":"8952376098bcb81e28e4ba88:22","kind":"state","metadata":{"status":"completed"},"sequence":22},{"content_ref":"23","id":"8952376098bcb81e28e4ba88:23","kind":"evaluator","metadata":{"evaluator":"unknown-usage-properties-v1","score":1,"status":"pass"},"sequence":23},{"content_ref":"24","id":"8952376098bcb81e28e4ba88:24","kind":"artifact","metadata":{"path":"patch.diff","sha256":"d39499bb3ef38f301525950856d6b7c32d7b9f9da53ff3113a4364d3dda09e8a"},"sequence":24},{"content_ref":"25","id":"8952376098bcb81e28e4ba88:25","kind":"artifact","metadata":{"path":"verification.json","sha256":"86548adc0f96a8925aa12dfa2a3a5fd1d0165898c983d834f7f1005ba0883490"},"sequence":25},{"content_ref":"26","id":"8952376098bcb81e28e4ba88:26","kind":"artifact","metadata":{"path":"permissions.json","sha256":"479a5370fde743713eb1c1c3a760e03ba8c03c80b8f935825958cec13ac74713"},"sequence":26},{"content_ref":"27","id":"8952376098bcb81e28e4ba88:27","kind":"artifact","metadata":{"path":"conventions.json","sha256":"8b769247a262835b64c1da7224cdb4eca15e65d5e0cad9c60eb14625497580f8"},"sequence":27},{"content_ref":"28","id":"8952376098bcb81e28e4ba88:28","kind":"artifact","metadata":{"path":"workspace/runtime.py","sha256":"83722da688ce38e5d41cbd9c55ec5be79a99f7c7f28a5f0bfa32ef5d2fcdd962"},"sequence":28},{"content_ref":"29","id":"8952376098bcb81e28e4ba88:29","kind":"artifact","metadata":{"path":"workspace/AGENTS.md","sha256":"8bf73f4882cf2a8252f0074f34f27b789faa9c8c2612b20522dee34d1c83e073"},"sequence":29},{"content_ref":"30","id":"8952376098bcb81e28e4ba88:30","kind":"artifact","metadata":{"path":"workspace/pyproject.toml","sha256":"2ca10c129844d5f6892088492957c780b58ea2c2f452a1af871d67241d8d34e8"},"sequence":30},{"content_ref":"31","id":"8952376098bcb81e28e4ba88:31","kind":"measurements","metadata":{"sources":{"cpu_seconds":"measured:process_time/harness-only","peak_ram_bytes":"sampled:/proc/VmRSS/harness+ollama-process-tree/200ms","peak_vram_bytes":"sampled:nvidia-smi/harness+ollama-process-tree/200ms","tool_seconds":"measured:perf_counter/tool-boundaries","wall_seconds":"measured:perf_counter/end-to-end"},"values":{"cpu_seconds":0.05899254100000001,"cpu_utilization":null,"energy_joules":null,"gpu_seconds":null,"gpu_utilization":null,"inference_seconds":null,"peak_ram_bytes":74338304,"peak_vram_bytes":0,"setup_seconds":null,"tool_seconds":0.06296800000018266,"wall_seconds":0.27626072599923646}},"sequence":31}],"parent_run_id":null,"replayable":true,"run_id":"8952376098bcb81e28e4ba88","schema_version":1,"task_id":"repository-unknown-usage"}
