{"artifacts":{"output.json":"4b0387a54b3a3e7171ee14f3bc976296bc6ac33316c5b2e0737e0525396952fd"},"configuration_id":"f0c062fc844b6126696f3da6de8e5caa87ac761502cd80c796997f7ba22ebc55","events":[{"content_ref":null,"id":"885c841b5c06e974e86789fd:0","kind":"state","metadata":{"status":"running"},"sequence":0},{"content_ref":null,"id":"885c841b5c06e974e86789fd:1","kind":"context","metadata":{},"sequence":1},{"content_ref":null,"id":"885c841b5c06e974e86789fd:2","kind":"model_request","metadata":{},"sequence":2},{"content_ref":null,"id":"885c841b5c06e974e86789fd:3","kind":"model_response","metadata":{},"sequence":3},{"content_ref":null,"id":"885c841b5c06e974e86789fd:4","kind":"tool_request","metadata":{},"sequence":4},{"content_ref":null,"id":"885c841b5c06e974e86789fd:5","kind":"tool_result","metadata":{},"sequence":5},{"content_ref":null,"id":"885c841b5c06e974e86789fd:6","kind":"tool_request","metadata":{},"sequence":6},{"content_ref":null,"id":"885c841b5c06e974e86789fd:7","kind":"tool_result","metadata":{},"sequence":7},{"content_ref":null,"id":"885c841b5c06e974e86789fd:8","kind":"tool_request","metadata":{},"sequence":8},{"content_ref":null,"id":"885c841b5c06e974e86789fd:9","kind":"tool_result","metadata":{},"sequence":9},{"content_ref":null,"id":"885c841b5c06e974e86789fd:10","kind":"context","metadata":{},"sequence":10},{"content_ref":null,"id":"885c841b5c06e974e86789fd:11","kind":"model_request","metadata":{},"sequence":11},{"content_ref":null,"id":"885c841b5c06e974e86789fd:12","kind":"model_response","metadata":{},"sequence":12},{"content_ref":null,"id":"885c841b5c06e974e86789fd:13","kind":"state","metadata":{"status":"completed"},"sequence":13},{"content_ref":null,"id":"885c841b5c06e974e86789fd:14","kind":"evaluator","metadata":{"evaluator":"exact-v1","score":0,"status":"fail"},"sequence":14},{"content_ref":null,"id":"885c841b5c06e974e86789fd:15","kind":"measurements","metadata":{"sources":{"cpu_seconds":"measured:process_time/harness-only","inference_seconds":"reported:backend/prompt+generation","peak_ram_bytes":"sampled:/proc/VmRSS/harness+ollama-process-tree/200ms","peak_vram_bytes":"sampled:nvidia-smi/ollama-process-tree-allocations/200ms","setup_seconds":"reported:backend/model-load","tool_seconds":"measured:perf_counter/tool-boundaries","wall_seconds":"measured:perf_counter/end-to-end"},"values":{"cpu_seconds":0.28970908400000006,"cpu_utilization":null,"energy_joules":null,"gpu_seconds":null,"gpu_utilization":null,"inference_seconds":2.042461,"peak_ram_bytes":899903488,"peak_vram_bytes":4922015744,"setup_seconds":0.273584043,"tool_seconds":4.0204999095294625e-05,"wall_seconds":2.4411262200001147}},"sequence":15},{"content_ref":null,"id":"885c841b5c06e974e86789fd:16","kind":"artifact","metadata":{"path":"output.json","sha256":"4b0387a54b3a3e7171ee14f3bc976296bc6ac33316c5b2e0737e0525396952fd"},"sequence":16}],"parent_run_id":null,"replayable":false,"run_id":"885c841b5c06e974e86789fd","schema_version":1,"task_id":"batch-sum"}
