{"artifacts":{"output.json":"cc4a8c2376b02a1ca43961006c4407e9fbcd2bed443ba400bdffc8646a424156"},"configuration_id":"b826e532f0053ae09dccae2ce580cc85d647cea3f787947df41ec0adf2176040","events":[{"content_ref":null,"id":"73ab1caff1d241a86313499d:0","kind":"state","metadata":{"status":"running"},"sequence":0},{"content_ref":null,"id":"73ab1caff1d241a86313499d:1","kind":"context","metadata":{},"sequence":1},{"content_ref":null,"id":"73ab1caff1d241a86313499d:2","kind":"model_request","metadata":{},"sequence":2},{"content_ref":null,"id":"73ab1caff1d241a86313499d:3","kind":"model_response","metadata":{},"sequence":3},{"content_ref":null,"id":"73ab1caff1d241a86313499d:4","kind":"tool_request","metadata":{},"sequence":4},{"content_ref":null,"id":"73ab1caff1d241a86313499d:5","kind":"tool_result","metadata":{},"sequence":5},{"content_ref":null,"id":"73ab1caff1d241a86313499d:6","kind":"tool_request","metadata":{},"sequence":6},{"content_ref":null,"id":"73ab1caff1d241a86313499d:7","kind":"tool_result","metadata":{},"sequence":7},{"content_ref":null,"id":"73ab1caff1d241a86313499d:8","kind":"tool_request","metadata":{},"sequence":8},{"content_ref":null,"id":"73ab1caff1d241a86313499d:9","kind":"tool_result","metadata":{},"sequence":9},{"content_ref":null,"id":"73ab1caff1d241a86313499d:10","kind":"context","metadata":{},"sequence":10},{"content_ref":null,"id":"73ab1caff1d241a86313499d:11","kind":"model_request","metadata":{},"sequence":11},{"content_ref":null,"id":"73ab1caff1d241a86313499d:12","kind":"model_response","metadata":{},"sequence":12},{"content_ref":null,"id":"73ab1caff1d241a86313499d:13","kind":"state","metadata":{"status":"completed"},"sequence":13},{"content_ref":null,"id":"73ab1caff1d241a86313499d:14","kind":"evaluator","metadata":{"evaluator":"exact-v1","score":1,"status":"pass"},"sequence":14},{"content_ref":null,"id":"73ab1caff1d241a86313499d:15","kind":"measurements","metadata":{"sources":{"cpu_seconds":"measured:process_time/harness-only","inference_seconds":"reported:backend/prompt+generation","peak_ram_bytes":"sampled:/proc/VmRSS/harness+ollama-process-tree/200ms","peak_vram_bytes":"sampled:nvidia-smi/ollama-process-tree-allocations/200ms","setup_seconds":"reported:backend/model-load","tool_seconds":"measured:perf_counter/tool-boundaries","wall_seconds":"measured:perf_counter/end-to-end"},"values":{"cpu_seconds":0.246432078,"cpu_utilization":null,"energy_joules":null,"gpu_seconds":null,"gpu_utilization":null,"inference_seconds":1.6481690000000002,"peak_ram_bytes":875405312,"peak_vram_bytes":4919918592,"setup_seconds":0.257984188,"tool_seconds":3.746999936993234e-05,"wall_seconds":2.0479376729999785}},"sequence":15},{"content_ref":null,"id":"73ab1caff1d241a86313499d:16","kind":"artifact","metadata":{"path":"output.json","sha256":"cc4a8c2376b02a1ca43961006c4407e9fbcd2bed443ba400bdffc8646a424156"},"sequence":16}],"parent_run_id":null,"replayable":false,"run_id":"73ab1caff1d241a86313499d","schema_version":1,"task_id":"batch-sum"}
